<?xml version="1.0" encoding="UTF-8"?>
<xs:schema xmlns:xs="http://www.w3.org/2001/XMLSchema">
    <xs:element name="list">
        <xs:complexType>
            <xs:sequence>
                <xs:element name="student">
                    <xs:complexType>
                        <xs:sequence>
                            <xs:element name="title" type="xs:string" />
                            <xs:element name="description" type="xs:string" />
                            <xs:element name="members" type="xs:string" />
                            <xs:element name="semester" type="xs:string" />
                            <xs:element name="link" type="xs:string" />
                            <xs:element name="email" type="xs:string" />
                        </xs:sequence>
                        <xs:attribute name="id" type="xs:integer" use="required" />
                    </xs:complexType>
                </xs:element>
            </xs:sequence>
        </xs:complexType>
    </xs:element>
</xs:schema>